location,day,meal,zone,dish,ingredients
Tercero Dining Commons,Thursday,Dinner,Green,Traditional Hummus,"Traditional hummus (cooked chickpeas, water, sesame tahini, olive oil. contains 2% or less of lemon juice, salt, garlic puree [garlic, citric acid, ascorbic acid], spices. per manufacturer, may contain soy)"
Tercero Dining Commons,Thursday,Dinner,Green,Tomato Bisque Soup,"Tomato bisque soup (daylight) (organic diced tomatoes [fresh vine-ripened organic california tomatoes, calcium chloride, citric acid], water, organic cream, organic onion, organic tomato paste [vine-ripened fresh organic tomatoes, citric acid], organic rice flour, organic milk, organic brown sugar, organic garlic, sea salt, organic cultured dextrose [organic cultured dextrose, organic maltodextrin], organic black pepper)"
Tercero Dining Commons,Thursday,Dinner,Green,Turkey Chili with Beans,"Turkey chili w/ beans soup (daylight) (ground turkey, tomato in heavy puree [tomatoes, tomato puree, citric acid], diced tomatoes [diced tomatoes, tomato juice, sea salt, calcium chloride, citric acid], kidney beans, onion, tomato puree [fresh vine ripened california tomatoes, citric acid], red bell pepper, garlic, cumin, lemon juice, sea salt, cultured dextrose, ancho chili peppers, chili powder, coriander, cayenne pepper, cinnamon, oregano)"
Tercero Dining Commons,Thursday,Dinner,Purple,Mediterranean Bar,"Za'atar lemon chicken drumstick (Za'tar lemon chicken drumstick (Fresh raw halal chicken drumstick, Bottled Lemon Juice, Canola and Olive Oil Blend 75/25 (75% canola oil, 25% extra virgin olive oil), za'atar seasoning (Ground cumin, Ground Coriander, Dried Ground Sumac, Dried Whole Thyme Leaves, Dried Crushed Red Pepper Flakes), Whole Peeled Garlic Cloves, Fresh Italian Parsley Sprigs, Coarse Flake Kosher Salt (salt, yellow prussiate of soda))), turmeric and raisin rice (Tap water, Dried White Basmati Rice, Dark Seedless Raisins (raisins), 1/4in Diced Yellow Onions, Ground Turmeric, Extra Virgin Olive Oil, Coarse Flake Kosher Salt (salt, yellow prussiate of soda), Whole Peeled Garlic Cloves, Ground Cumin, Ground Cinnamon), cauliflower rice with lemon and parsley (Fresh cauliflower rice, Extra Virgin Olive Oil, Coarse Flake Kosher Salt (salt, yellow prussiate of soda), Bottled Lemon Juice, Fresh Italian Parsley Sprigs), spicy italian pork sausage (Spicy italian pork sausage bulk (pork, spices, water, salt, corn syrup solids, paprika, granulated garlic, sugar, lemon juice powder [corn syrup solids, lemon juice solids, lemon oil], bha, bht, citric acid), Canola and Olive Oil Blend 90/10 (canola oil, extra virgin olive oil)), roasted paprika sweet potatoes (3/4in diced peeled sweet potatoes, Canola and Olive Oil Blend 90/10 (canola oil, extra virgin olive oil), Coarse Flake Kosher Salt (salt, yellow prussiate of soda), Smoked Paprika (paprika, silicon dioxide), Coarse Ground Black Pepper), roasted herb red potatoes (Quartered skin-on red potatoes, Bottled Lemon Juice, Canola and Olive Oil Blend 90/10 (canola oil, extra virgin olive oil), Coarse Flake Kosher Salt (salt, yellow prussiate of soda), Fresh Italian Parsley Sprigs, Fresh Thyme Sprigs, Dried Mediterranean Oregano Leaves), roasted and grilled eggplant (Fresh whole globe eggplant, Canola and Olive Oil Blend 90/10 (canola oil, extra virgin olive oil), Coarse Flake Kosher Salt (salt, yellow prussiate of soda), Whole Peeled Garlic Cloves, Shaker Ground Black Pepper), roasted artichoke hearts (Canned quartered artichoke hearts (artichokes, water, salt, citric acid, ascorbic acid), Canola and Olive Oil Blend 90/10 (canola oil, extra virgin olive oil), Coarse Flake Kosher Salt (salt, yellow prussiate of soda), Whole Peeled Garlic Cloves, Shaker Ground Black Pepper), pitted bistro olive mix (Pitted bistro mix olives (pitted olive blend, water, salt, red wine vinegar, chardonnay wine, spices)), slow roasted cherry tomatoes (Whole red grape cherry tomatoes, Canola and Olive Oil Blend 90/10 (canola oil, extra virgin olive oil), Whole Peeled Garlic Cloves, Fresh Thyme Sprigs, Fresh Whole Rosemary Sprigs), lemon roasted carrots (Carrot stick, Bottled Lemon Juice, Canola and Olive Oil Blend 90/10 (canola oil, extra virgin olive oil), Coarse Flake Kosher Salt (salt, yellow prussiate of soda), Shaker Ground Black Pepper), diced peeled cucumber (1/2in diced peeled cucumbers), zhug (Canola and olive oil blend 90/10 (canola oil, extra virgin olive oil), Bottled Lemon Juice, Fresh Cilantro Sprigs, Fresh Italian Parsley Sprigs, Coarse Flake Kosher Salt (salt, yellow prussiate of soda), Ground Cumin, Ground Coriander, Dried Crushed Red Pepper Flakes, Coarse Ground Black Pepper), grilled lemons (Fresh whole lemons, Canola and Olive Oil Blend 90/10 (canola oil, extra virgin olive oil)), tomato basil vinaigrette (Canola and olive oil blend 90/10 (canola oil, extra virgin olive oil), Natural Rice Vinegar, 1/2in Diced Tomatoes, Vegan Fine Granulated White Sugar, Iodized Granulated Salt (salt, sodium silicoaluminate, dextrose, potassium iodine, sodium bicarbonate), Whole Peeled Garlic Cloves, Fresh Basil Leaves, Shaker Ground Black Pepper), allergy-friendly hummus (Tap water, Canned Garbanzo Beans (prepared chickpeas, water, salt, calcium chloride, disodium EDTA), Bottled Lemon Juice, Canola and Olive Oil Blend 90/10 (canola oil, extra virgin olive oil), Coarse Flake Kosher Salt (salt, yellow prussiate of soda), Natural Rice Vinegar), fried chickpeas (Canned garbanzo beans (prepared chickpeas, water, salt, calcium chloride, disodium edta), Rice Bran Fryer Oil (NGMO rice bran oil, RDW), Coarse Flake Kosher Salt (salt, yellow prussiate of soda), Smoked Paprika (paprika, silicon dioxide)), chopped romaine lettuce (Chopped romaine lettuce)"
Tercero Dining Commons,Thursday,Dinner,Purple,Plant Forward Mediterranean Bar,"Turmeric and raisin rice (Tap water, Dried White Basmati Rice, Dark Seedless Raisins (raisins), 1/4in Diced Yellow Onions, Ground Turmeric, Extra Virgin Olive Oil, Coarse Flake Kosher Salt (salt, yellow prussiate of soda), Whole Peeled Garlic Cloves, Ground Cumin, Ground Cinnamon), cauliflower rice with lemon and parsley (Fresh cauliflower rice, Extra Virgin Olive Oil, Coarse Flake Kosher Salt (salt, yellow prussiate of soda), Bottled Lemon Juice, Fresh Italian Parsley Sprigs), roasted paprika sweet potatoes (3/4in diced peeled sweet potatoes, Canola and Olive Oil Blend 90/10 (canola oil, extra virgin olive oil), Coarse Flake Kosher Salt (salt, yellow prussiate of soda), Smoked Paprika (paprika, silicon dioxide), Coarse Ground Black Pepper), roasted herb red potatoes (Quartered skin-on red potatoes, Bottled Lemon Juice, Canola and Olive Oil Blend 90/10 (canola oil, extra virgin olive oil), Coarse Flake Kosher Salt (salt, yellow prussiate of soda), Fresh Italian Parsley Sprigs, Fresh Thyme Sprigs, Dried Mediterranean Oregano Leaves), roasted and grilled eggplant (Fresh whole globe eggplant, Canola and Olive Oil Blend 90/10 (canola oil, extra virgin olive oil), Coarse Flake Kosher Salt (salt, yellow prussiate of soda), Whole Peeled Garlic Cloves, Shaker Ground Black Pepper), roasted artichoke hearts (Canned quartered artichoke hearts (artichokes, water, salt, citric acid, ascorbic acid), Canola and Olive Oil Blend 90/10 (canola oil, extra virgin olive oil), Coarse Flake Kosher Salt (salt, yellow prussiate of soda), Whole Peeled Garlic Cloves, Shaker Ground Black Pepper), pitted bistro olive mix (Pitted bistro mix olives (pitted olive blend, water, salt, red wine vinegar, chardonnay wine, spices)), slow roasted cherry tomatoes (Whole red grape cherry tomatoes, Canola and Olive Oil Blend 90/10 (canola oil, extra virgin olive oil), Whole Peeled Garlic Cloves, Fresh Thyme Sprigs, Fresh Whole Rosemary Sprigs), lemon roasted carrots (Carrot stick, Bottled Lemon Juice, Canola and Olive Oil Blend 90/10 (canola oil, extra virgin olive oil), Coarse Flake Kosher Salt (salt, yellow prussiate of soda), Shaker Ground Black Pepper), diced peeled cucumber (1/2in diced peeled cucumbers), zhug (Canola and olive oil blend 90/10 (canola oil, extra virgin olive oil), Bottled Lemon Juice, Fresh Cilantro Sprigs, Fresh Italian Parsley Sprigs, Coarse Flake Kosher Salt (salt, yellow prussiate of soda), Ground Cumin, Ground Coriander, Dried Crushed Red Pepper Flakes, Coarse Ground Black Pepper), grilled lemons (Fresh whole lemons, Canola and Olive Oil Blend 90/10 (canola oil, extra virgin olive oil)), tomato basil vinaigrette (Canola and olive oil blend 90/10 (canola oil, extra virgin olive oil), Natural Rice Vinegar, 1/2in Diced Tomatoes, Vegan Fine Granulated White Sugar, Iodized Granulated Salt (salt, sodium silicoaluminate, dextrose, potassium iodine, sodium bicarbonate), Whole Peeled Garlic Cloves, Fresh Basil Leaves, Shaker Ground Black Pepper), allergy-friendly hummus (Tap water, Canned Garbanzo Beans (prepared chickpeas, water, salt, calcium chloride, disodium EDTA), Bottled Lemon Juice, Canola and Olive Oil Blend 90/10 (canola oil, extra virgin olive oil), Coarse Flake Kosher Salt (salt, yellow prussiate of soda), Natural Rice Vinegar), fried chickpeas (Canned garbanzo beans (prepared chickpeas, water, salt, calcium chloride, disodium edta), Rice Bran Fryer Oil (NGMO rice bran oil, RDW), Coarse Flake Kosher Salt (salt, yellow prussiate of soda), Smoked Paprika (paprika, silicon dioxide)), chopped romaine lettuce (Chopped romaine lettuce)"
Tercero Dining Commons,Thursday,Dinner,Pink,Strawberry Shortcake,"Frozen strawberry shortcake (whipping cream [cream, milk, cellulose gel, carrageenan, cellulose gum], sweetened strawberries [strawberries, sugar], sugar, water, enriched bleached wheat flour [wheat flour, niacin, iron, thiamin, riboflavin, folic acid], eggs, confectioner's sugar [sugar, corn starch], canola oil, modified corn starch, nonfat dry milk, baking powder [sodium acid pyrophosphate, sodium bicarbonate, corn starch, monocalcium phosphate, calcium sulfate], modified tapioca starch, alginate blend [sodium alginate, sugar, sodium hexametaphosphate, calcium hydrogen phosphate], salt, natural flavors, concentrated lemon juice, alginate blend [tetrasodium diphosphate, sodium alginate], xanthan gum. per manufacturer, may contain peanuts, tree nuts, and soy)"
Tercero Dining Commons,Thursday,Dinner,Pink,Tres Leches Cake,"Frozen tres leches cake (sugar, enriched flour bleached [wheat flour, niacin, iron, thiamin mononitrate, riboflavin, folic acid], palm oil, egg white, egg yolk with sodium silicoaluminate, nonfat milk, leavening [baking soda, sodium aluminum phosphate, monocalcium phosphate], dextrose, modified tapioca starch, salt, propylene glycol, mono- and diesters of fatty acids, sorbitan monostearate, tetrasodium pyrophosphate, xanthan gum, cellulose gum, artificial flavor, egg, water, condensed milk [whole milk, sugar, whipping cream], icing [water, hydrogenated palm kernel oil, sugar, corn syrup, contains less than 2% of polysorbate 60, artificial flavor, carbohydrate gum, salt, sodium stearoyl lactylate, sorbitan monostearate, sodium citrate, soy lecithin, xanthan gum], milk [sugar, cream, skim milk, corn syrup, whey protein concentrate], contains less than 2% of water, sweetened condensed milk [milk, sugar, skim milk], salt, mono- and diglycerides, cellulose gum, high fructose corn syrup, natural flavor, dextrose, sodium pyrophosphate, natural and artificial flavor, carrageenan, sodium bicarbonate, disodium phosphate, colored with [caramel color, annatto], vanilla extract)"
Tercero Dining Commons,Thursday,Dinner,Pink,Dark Chocolate Cranberry Cookie,"Dark chocolate cranberry cookie (unbleached wheat flour, pure cane sugars, guittard bittersweet chocolate [fair trade cocoa beans, sugar, sunflower lecithin, pure vanilla], dried cranberries, butter [made from milk], eggs [pasteurized, may contain citric acid], grape juice, rice dextrins, pure vanilla, baking soda, sea salt. per manufacturer, this product is made in a facility that uses peanuts, tree nuts, milk, and soy)"
Tercero Dining Commons,Thursday,Dinner,Pink,Macadamias with White Chocolate Chips Cookie,"Macadamias with white chocolate chips cookie (unbleached wheat flour, pure cane sugars, butter [made from milk], white chocolate [sugar, cocoa butter, milk, sunflower lecithin, vanilla], macadamia nuts, palm oil, eggs [pasteurized, may contain citric acid] grape juice, rice dextrins, shredded coconut, sea salt, baking soda, pure vanilla. per manufacturer, this product is made in a facility that uses peanuts, tree nuts, milk, and soy)"
Tercero Dining Commons,Thursday,Dinner,Pink,Chocolate Chip Cookie,"Vegan chocolate chip cookie (vegan chocolate chips [organic cane sugar, unsweetened chocolate, cocoa butter, soy lecithin, vanilla bean seeds], unbleached wheat flour, organic evaporated cane sugar, sustainable rspo palm oil shortening, vegan molasses, grape juice, rice dextrins, sea salt, pure vanilla, baking soda. per manufacturer, this product is made in a facility that uses peanuts, tree nuts, milk, and soy)"
Tercero Dining Commons,Thursday,Dinner,Pink,Lemon Drop Cookie,"Vegan lemon drop cookie (unbleached wheat flour, organic evaporated cane sugar, sustainable rspo palm oil shortening, pure lemon extract, grape juice, rice dextrin, sea salt, baking powder)"
Tercero Dining Commons,Friday,Breakfast,Yellow,Build Your Own Omelette,"Salsa verde with red chile (Whole cleaned tomatillos, 1/4in Diced Yellow Onions, Bottled Lemon Juice, Iodized Granulated Salt (salt, sodium silicoaluminate, dextrose, potassium iodine, sodium bicarbonate), Whole Peeled Garlic Cloves, Fresh Cilantro Sprigs, Dried Whole Guajillo Chilis), roasted house salsa (Russell ranch tomatoes (Whole roma tomatoes), Fresh Whole Green Jalapeno Peppers, Whole Peeled Yellow Onions, Fresh Whole Fresno Red Peppers, Whole Peeled Garlic Cloves, Canola Salad Oil, Fresh Whole Habanero Peppers, Fresh Cilantro Sprigs, Iodized Granulated Salt (salt, sodium silicoaluminate, dextrose, potassium iodine, sodium bicarbonate)), shredded chicken (Fresh raw boneless skinless halal chicken thigh, fajita seasoning (Iodized granulated salt (salt, sodium silicoaluminate, dextrose, potassium iodine, sodium bicarbonate), Onion Powder (onion powder), Vegan Fine Granulated White Sugar, Lemon Pepper Spice Mix (salt, spices, citric acid, onion, monosodium glutamate, sugar, corn starch, garlic, silicon dioxide, natural flavor, FD&amp;C yellow 5), Granulated Garlic, Domestic Paprika (paprika, silicon dioxide), Ground Cumin, Vegan Fine Granulated White Sugar, Ground White Pepper, season salt, production)), diced red bell peppers (1/4in diced red bell peppers), diced green bell peppers (1/4in diced green bell peppers), sliced cremini mushrooms (Sliced cremini mushrooms), diced yellow onions (1/4in diced yellow onions), shredded cheddar cheese (Shredded feather yellow mild cheddar cheese (cultured milk, salt, enzymes, annatto, potato starch, natamycin)), basic omelette (Liquid whole eggs (cage-free whole eggs, citric acid), Canola and Olive Oil Blend 90/10 (canola oil, extra virgin olive oil)), chorizo crumbles (Cooked chorizo crumbled (pork, water, spices, paprika, salt, dried vinegar, sugar, natural flavorings, dehydrated garlic, turmeric)), breakfast pork sausage links (Frozen precooked pork sausage link (pork, water. contains 2% or less of salt, sugar, spices, chili pepper, flavoring, smoke flavor, collagen casing)), soy chorizo crumbles (Soy chorizo sausage crumbles (water, organic textured soy protein [soy flour], organic soybean oil, organic distilled vinegar, organic seasoning [organic chile pepper, organic spices, salt, organic paprika, organic dextrose, organic ancho chile powder, organic onion powder, organic garlic powder, sea salt, natural extractives of paprika], salt, organic caramel color, natural extractives of paprika)), baked honey ham (Fresh hickory smoked boneless ham (boneless cooked pit ham, water, salt, potassium lactate, sodium lactate, sugar, sodium phosphate, sodium diacetate, sodium erythorbate, sodium nitrate), Tap Water, Spicy Brown Mustard (organic vinegar, water, mustard seed, salt. Contains less than 2% of turmeric), Honey, Dried Whole Cloves), bacon (Raw 10/12 sliced pork bacon (pork cured with water, salt, sugar, sodium phosphate, sodium erythorbate, flavoring, sodium nitrite))"
Tercero Dining Commons,Friday,Breakfast,Yellow,Build Your Own Veggie Omelette,"Salsa verde with red chile (Whole cleaned tomatillos, 1/4in Diced Yellow Onions, Bottled Lemon Juice, Iodized Granulated Salt (salt, sodium silicoaluminate, dextrose, potassium iodine, sodium bicarbonate), Whole Peeled Garlic Cloves, Fresh Cilantro Sprigs, Dried Whole Guajillo Chilis), roasted house salsa (Russell ranch tomatoes (Whole roma tomatoes), Fresh Whole Green Jalapeno Peppers, Whole Peeled Yellow Onions, Fresh Whole Fresno Red Peppers, Whole Peeled Garlic Cloves, Canola Salad Oil, Fresh Whole Habanero Peppers, Fresh Cilantro Sprigs, Iodized Granulated Salt (salt, sodium silicoaluminate, dextrose, potassium iodine, sodium bicarbonate)), diced red bell peppers (1/4in diced red bell peppers), diced green bell peppers (1/4in diced green bell peppers), sliced cremini mushrooms (Sliced cremini mushrooms), diced yellow onions (1/4in diced yellow onions), shredded cheddar cheese (Shredded feather yellow mild cheddar cheese (cultured milk, salt, enzymes, annatto, potato starch, natamycin)), just egg - plant based (Plant-based liquid egg (water, mung bean protein, expeller-pressed canola oil. contains less than 2% of dehydrated onion, gellan gum, carrot extractives, natural flavors, turmeric extractives, potassium citrate, salt, soy lecithin, sugar, tapioca syrup solids, tetrasodium pyrophosphate, transglutaminase, nisin)), soy chorizo crumbles (Soy chorizo sausage crumbles (water, organic textured soy protein [soy flour], organic soybean oil, organic distilled vinegar, organic seasoning [organic chile pepper, organic spices, salt, organic paprika, organic dextrose, organic ancho chile powder, organic onion powder, organic garlic powder, sea salt, natural extractives of paprika], salt, organic caramel color, natural extractives of paprika)), scrambled tofu (Tofu (Firm tofu), 1/4in Diced Yellow Onions, 1/2in Diced Red Bell Peppers, 1/2in Diced Green Bell Peppers, Regular Soy Sauce (water, soybeans, wheat, salt. Contains less than 1% of sodium benzoate), Nutritional Yeast Flakes, Canola Salad Oil, Ground Turmeric, Whole Peeled Garlic Cloves)"
Tercero Dining Commons,Friday,Breakfast,Yellow,Fried Eggs to Order,"Whole large white eggs, Canola Salad Oil"
Tercero Dining Commons,Friday,Breakfast,Yellow,Scrambled Egg Whites,"Liquid egg whites (egg whites), Canola and Olive Oil Blend 90/10 (canola oil, extra virgin olive oil)"
Tercero Dining Commons,Friday,Breakfast,Yellow,Scrambled Tofu,"Tofu (Firm tofu), 1/4in Diced Yellow Onions, 1/2in Diced Red Bell Peppers, 1/2in Diced Green Bell Peppers, Regular Soy Sauce (water, soybeans, wheat, salt. Contains less than 1% of sodium benzoate), Nutritional Yeast Flakes, Canola Salad Oil, Ground Turmeric, Whole Peeled Garlic Cloves"
Tercero Dining Commons,Friday,Breakfast,Yellow,Just Egg - Plant Based,"Plant-based liquid egg (water, mung bean protein, expeller-pressed canola oil. contains less than 2% of dehydrated onion, gellan gum, carrot extractives, natural flavors, turmeric extractives, potassium citrate, salt, soy lecithin, sugar, tapioca syrup solids, tetrasodium pyrophosphate, transglutaminase, nisin)"
Tercero Dining Commons,Friday,Breakfast,Blue,Waffle Bar,"Pancake and waffle syrup (Pancake and waffle syrup (corn syrup, water, natural and artificial flavor, salt, cellulose gum, potassium sorbate, caramel color, citric acid, sorbic acid)), mango chunks (Frozen mango chunks), blueberries (Frozen whole blueberries), whipped cream (Canned whipped topping (water, hydrogenated palm kernel oil, sugar. contains less than 1% of sodium caseinate, polysorbate 60, mono- and diglycerides, sorbitan monostearate, disodium phosphate, hexaglyceryl distearate, artificial flavor, carrageenan, beta carotene, nitrous oxide)), belgian waffle (4in belgian waffle (enriched wheat flour [bleached wheat flour, niacin, reduced iron, thiamin mononitrate, riboflavin, folic acid. may contain malted barley flour], water, eggs, sugar, soybean and/or canola oil, egg whites. contains less than 2% of leavening [sodium bicarbonate, sodium aluminum phosphate, monocalcium phosphate, sodium acid pyrophosphate], salt, soy lecithin, emulsifier blend [propylene glycol monoesters, mono- and diglycerides, sodium stearoyl lactylate], natural flavors [including from dairy]))"
Tercero Dining Commons,Friday,Breakfast,Blue,Scrambled Egg,"Liquid whole eggs (cage-free whole eggs, citric acid), Canola Salad Oil"
Tercero Dining Commons,Friday,Breakfast,Blue,Breakfast Pork Sausage Links,"Frozen precooked pork sausage link (pork, water. contains 2% or less of salt, sugar, spices, chili pepper, flavoring, smoke flavor, collagen casing)"
Tercero Dining Commons,Friday,Breakfast,Blue,Potatoes O'Brien,"1/2in diced peeled red potatoes, Canned Diced Red Peppers (red sweet pepper, water, citric acid), 1/4in Diced Yellow Onions, Canola Salad Oil, Coarse Flake Kosher Salt (salt, yellow prussiate of soda), Fresh Italian Parsley Sprigs, Ground White Pepper"
Tercero Dining Commons,Friday,Breakfast,Green,Overnight Oats,"Vanilla soy milk (organic soy base [water, organic soybeans], cane sugar. contains 1% or less of carrageenan, dipotassium phosphate, expeller-pressed canola oil, natural vanilla flavor with other natural flavors, sea salt, sodium citrate), Old Fashioned Rolled Oats (whole grain oats. Per manufacturer, may contain soy and wheat/gluten), Vanilla Greek Yogurt (cultured pasteurized grade A nonfat milk, water, sugar, fructose, modified food starch, natural flavor, citric acid, vanilla extract), Canned Coconut Milk, plain steamed quinoa (Tap water, Dried Tricolor Quinoa), Vegan Fine Granulated White Sugar, Honey, Chia Seeds, Coarse Flake Kosher Salt (salt, yellow prussiate of soda), Ground Cinnamon"
Tercero Dining Commons,Friday,Breakfast,Green,Oatmeal,"Tap water, Old Fashioned Rolled Oats (whole grain oats. Per manufacturer, may contain soy and wheat/gluten), Coarse Flake Kosher Salt (salt, yellow prussiate of soda)"
Tercero Dining Commons,Friday,Breakfast,Green,Boiled Eggs,Whole large white eggs
Tercero Dining Commons,Friday,Breakfast,Green,Sticky Rice,"Dried white calrose rice, Tap Water"
Tercero Dining Commons,Friday,Breakfast,Green,Congee Rice Porridge,"Vegetable broth (Tap water, Paste Vegetable Soup Base (onions, celery, carrots, maltodextrin, sugar, autolyzed yeast extract, onion powder, salt, water, corn oil, potassium chloride, carrot powder, modified tapioca starch, carrot juice concentrate, tomato paste, garlic powder, disodium guanylate, disodium inosinate, natural flavor, potassium sorbate, citric acid, extractives of paprika)), Tap Water, Firm Tofu, Dried Broken Grain White Calrose Rice, Coarse Flake Kosher Salt (salt, yellow prussiate of soda), Sesame Oil, Ground White Pepper"
Tercero Dining Commons,Friday,Breakfast,Green,BYO Parfait,"Fresh fruit salad (Fresh fruit salad (pineapple, grape, melon) (cantaloupe, honeydew, pineapple, grapes)), local granola (Virtue premium granola (rolled oats, sunflower seeds, coconut, organic coconut oil, organic maple syrup, cinnamon, sea salt)), granola with dried fruits (Fruit granola (whole grain oats, sugar, raisins, crisp rice [rice flour, barley malt extract, salt], canola oil, cranberries, rice flour, molasses, honey, salt, baking soda, sunflower oil, natural flavor, vitamin e [mixed tocopherols] added to preserve freshness)), plain greek nonfat yogurt (Non-fat plain greek yogurt (cultured pasteurized grade a nonfat milk)), plain greek yogurt (Plain greek yogurt (cultured pasteurized grade a nonfat milk, cream)), plain yogurt (Plain yogurt (cultured pasteurized grade a low-fat milk, modified corn starch, kosher gelatin. live and active yogurt cultures: s. thermophilus, l. acidophilus, l. bulgaricus, b. lactis)), strawberry greek nonfat yogurt (Low fat strawberry yogurt (cultured grade a low-fat milk, sugar, modified corn starch. contains 1% or less of corn starch, citric acid, vegetable juice, natural flavor, potassium sorbate added to maintain freshness, vitamin a acetate, vitamin d3)), vanilla greek yogurt (Vanilla greek yogurt (cultured pasteurized grade a nonfat milk, water, sugar, fructose, modified food starch, natural flavor, citric acid, vanilla extract)), cottage cheese (Cottage cheese (cultured pasteurized nonfat milk, pasteurized milk, pasteurized cream, sea salt, stabilizer [nonfat milk, locust bean gum, agar], vitamin a palmitate, carbon dioxide. per manufacturer, milk or milk products, egg, soy, wheat (gluten), peanuts, tree nuts present at the same site; milk or milk products, egg, soy present in other products manufactured on the same line and present on other manufacturing lines in the same plant)), blueberries (Frozen whole blueberries), strawberries (Whole strawberries), sliced pears (Canned sliced pears in juice (pears, water, pear juice concentrate)), watermelon (Fresh whole red watermelon)"
