location,day,meal,zone,dish,ingredients
Tercero Dining Commons,Tuesday,Lunch,Yellow,Cheese Pizza,"12 in round fellas flatbread (soft wheat flour, water, sourdough [water, soft wheat flour], microfiltered sea water, iodized sea salt, extra-virgin olive oil. per manufacturer, may contain traces of milk, soy, sesame seeds, mustard, almonds, nuts, and pine nuts), Shredded Whole Milk Mozzarella Cheese (pasteurized milk, cheese cultures, salt, enzymes), pizza sauce (Canned coarse ground peeled pear tomatoes (tomatoes, tomato puree, salt, citric acid), Whole Peeled Garlic Cloves, Iodized Granulated Salt (salt, sodium silicoaluminate, dextrose, potassium iodine, sodium bicarbonate), Ground Cayenne Pepper, Italian Seasoning (marjoram, thyme, rosemary, savory, sage, oregano, basil), Coarse Ground Black Pepper, Dried Whole Thyme Leaves, Dried Whole Marjoram Leaves, Dried Mediterranean Oregano Leaves, Dried Basil Leaves (dried basil)), Shredded Parmesan Cheese (pasteurized part skim cow's milk, cheese cultures, salt, enzymes, potato starch, powdered cellulose, natamycin), garlic infused oil (Canola salad oil, Granulated Garlic, Italian Seasoning (marjoram, thyme, rosemary, savory, sage, oregano, basil)), Semolina (semolina, niacin, ferrous sulfate, thiamin mononitrate, riboflavin, folic acid)"
Tercero Dining Commons,Tuesday,Lunch,Blue,Build Your Own Burrito Bar,"Flour tortillas (12in flour tortillas (enriched bleached flour [wheat flour, niacin, reduced iron, thiamin mononitrate, riboflavin, folic acid], water, soybean oil, vegetable shortening {soybean oil, mono- and diglycerides, tocopherol [vitamin e], vitamin c palmitate}, salt, mono- and diglycerides, baking powder [sodium bicarbonate, cornstarch, sodium aluminum sulfate, calcium sulfate, monocalcium phosphate], calcium propionate, wheat gluten, fumaric acid, guar gum, xanthan gum, microcrystalline cellulose, l-cysteine)), veggie fajita mix (1/4in diced jalapeno peppers, Canola and Olive Oil Blend 90/10 (canola oil, extra virgin olive oil), Fresh Sliced Peppers and Onions (Fajita Mix), 1/2in Diced Tomatoes, Coarse Flake Kosher Salt (salt, yellow prussiate of soda), Coarse Ground Black Pepper), shredded chicken (Fresh raw boneless skinless halal chicken thigh, fajita seasoning (Iodized granulated salt (salt, sodium silicoaluminate, dextrose, potassium iodine, sodium bicarbonate), Onion Powder (onion powder), Vegan Fine Granulated White Sugar, Lemon Pepper Spice Mix (salt, spices, citric acid, onion, monosodium glutamate, sugar, corn starch, garlic, silicon dioxide, natural flavor, FD&amp;C yellow 5), Granulated Garlic, Domestic Paprika (paprika, silicon dioxide), Ground Cumin, Vegan Fine Granulated White Sugar, Ground White Pepper, season salt, production)), beef pot roast (Frozen beef pot roast (beef, water, natural flavorings, salt, flavorings [natural flavor, salt, potato maltodextrin, gum arabic], rubbed with salt, natural flavors, sugar, caramel color)), cilantro rice (Tap water, Dried White Long Grain Rice, 1/4in Diced Yellow Onions, Canola and Olive Oil Blend 90/10 (canola oil, extra virgin olive oil), Fresh Cilantro Sprigs, Coarse Flake Kosher Salt (salt, yellow prussiate of soda), Ground White Pepper, Ground Cumin, Whole Peeled Garlic Cloves, cilantro puree, rice), mexican rice (Tap water, Dried White Long Grain Rice, Canned Crushed Tomatoes (tomatoes, tomato puree, sea salt, citric acid), Canola Salad Oil, 1/4in Diced Yellow Onions, Paste Vegetable Soup Base (onions, celery, carrots, maltodextrin, sugar, autolyzed yeast extract, onion powder, salt, water, corn oil, potassium chloride, carrot powder, modified tapioca starch, carrot juice concentrate, tomato paste, garlic powder, disodium guanylate, disodium inosinate, natural flavor, potassium sorbate, citric acid, extractives of paprika), Shredded Orange Carrots, Frozen Corn Kernels (sweet white corn), 1/2in Diced Green Bell Peppers, Achiote Paste (annatto seeds, vinegar, salt, water, granulated garlic, spices, sodium benzoate, corn meal, corn flour, FD&amp;C 40), Granulated Garlic, 1/2in Diced Celery, Coarse Flake Kosher Salt (salt, yellow prussiate of soda), Ground Cayenne Pepper, rice, vegetable/achiote broth), chipotle pinto beans (Canned pinto beans (pinto beans, water, salt, calcium chloride, calcium disodium edta), Tap Water, 1/2in Diced Green and Red Bell Peppers, 1/2in Diced Yellow Onions, Bottled Lemon Juice, Canola and Olive Oil Blend 90/10 (canola oil, extra virgin olive oil), Chipotle Peppers in Adobo Sauce (water, tomato paste, dried Chipotle peppers, distilled vinegar, corn oil. Contains 2% or less of iodized salt, potassium iodate, corn starch, onion powder, garlic powder, spices), Coarse Flake Kosher Salt (salt, yellow prussiate of soda)), southwest black beans (Canned black beans (prepared black beans, water, salt, calcium chloride, ferrous gluconate), 1/4in Diced Yellow Onions, 3/8in Diced Tomatoes, Whole Peeled Garlic Cloves, Canola Salad Oil, Fresh Cilantro Sprigs, Ground Cumin, Bottled Lime Juice, Coarse Flake Kosher Salt (salt, yellow prussiate of soda), Dried Dark Chili Powder (chili pepper, spices, salt, silicon dioxide, garlic), Tabasco Hot Sauce (distilled vinegar, red pepper, salt), Shaker Ground Black Pepper), sour cream (Sour cream (cultured cream. contains less than 2% of whey, modified corn starch, sodium tripolyphosphate, carrageenan, calcium sulfate, locust bean gum, guar gum, potassium sorbate)), salsa verde with red chile (Whole cleaned tomatillos, 1/4in Diced Yellow Onions, Bottled Lemon Juice, Iodized Granulated Salt (salt, sodium silicoaluminate, dextrose, potassium iodine, sodium bicarbonate), Whole Peeled Garlic Cloves, Fresh Cilantro Sprigs, Dried Whole Guajillo Chilis), red enchilada sauce (Russell ranch tomatoes (Whole roma tomatoes), Tap Water, 1/4in Diced Yellow Onions, Dried Ground Guajillo Pepper Powder (chili pepper, silicon dioxide [anti-caking agent], ethoxyquin [antioxidant agent]), Liquid Vegetable Soup Base (tomato juice from concentrate, salt, yeast extract, sugar, potato starch, contains 2% or less of carrot extract, natural flavors), Coarse Flake Kosher Salt (salt, yellow prussiate of soda), Whole Peeled Garlic Cloves, Canola and Olive Oil Blend 90/10 (canola oil, extra virgin olive oil), Chipotle Peppers in Adobo Sauce (water, tomato paste, dried Chipotle peppers, distilled vinegar, corn oil. Contains 2% or less of iodized salt, potassium iodate, corn starch, onion powder, garlic powder, spices), National Starch 465 (modified food starch), Ground Cumin, Dried Mexican Oregano Leaves, Dried Ground Cloves), traditional guacamole (Frozen avocado pulp, 1/4in Pico De Gallo (tomatoes, onion, fresh cilantro, Jalapeno pepper), Bottled Lime Juice, Iodized Granulated Salt (salt, sodium silicoaluminate, dextrose, potassium iodine, sodium bicarbonate), Ground Cumin), pico de gallo (1/4in pico de gallo (tomatoes, onion, fresh cilantro, jalapeno pepper)), shredded cheddar jack cheese (Shredded fancy cheddar jack cheese (cheddar cheese [pasteurized milk, cheese culture, salt, enzymes, annatto {vegetable color}], monterey jack cheese [pasteurized milk, cheese culture, salt, enzymes], anti-caking blend [potato starch, powdered cellulose])), queso fresco (Whole queso fresco cheese (pasteurized grade a milk, sea salt, enzymes)), soy chorizo crumbles (Soy chorizo sausage crumbles (water, organic textured soy protein [soy flour], organic soybean oil, organic distilled vinegar, organic seasoning [organic chile pepper, organic spices, salt, organic paprika, organic dextrose, organic ancho chile powder, organic onion powder, organic garlic powder, sea salt, natural extractives of paprika], salt, organic caramel color, natural extractives of paprika)), topping options:, vegetable options:, bean options:, protein options:, rice options:"
Tercero Dining Commons,Tuesday,Lunch,Blue,Plant Forward Burrito Bar,"Flour tortillas (12in flour tortillas (enriched bleached flour [wheat flour, niacin, reduced iron, thiamin mononitrate, riboflavin, folic acid], water, soybean oil, vegetable shortening {soybean oil, mono- and diglycerides, tocopherol [vitamin e], vitamin c palmitate}, salt, mono- and diglycerides, baking powder [sodium bicarbonate, cornstarch, sodium aluminum sulfate, calcium sulfate, monocalcium phosphate], calcium propionate, wheat gluten, fumaric acid, guar gum, xanthan gum, microcrystalline cellulose, l-cysteine)), veggie fajita mix (1/4in diced jalapeno peppers, Canola and Olive Oil Blend 90/10 (canola oil, extra virgin olive oil), Fresh Sliced Peppers and Onions (Fajita Mix), 1/2in Diced Tomatoes, Coarse Flake Kosher Salt (salt, yellow prussiate of soda), Coarse Ground Black Pepper), cilantro rice (Tap water, Dried White Long Grain Rice, 1/4in Diced Yellow Onions, Canola and Olive Oil Blend 90/10 (canola oil, extra virgin olive oil), Fresh Cilantro Sprigs, Coarse Flake Kosher Salt (salt, yellow prussiate of soda), Ground White Pepper, Ground Cumin, Whole Peeled Garlic Cloves, cilantro puree, rice), mexican rice (Tap water, Dried White Long Grain Rice, Canned Crushed Tomatoes (tomatoes, tomato puree, sea salt, citric acid), Canola Salad Oil, 1/4in Diced Yellow Onions, Paste Vegetable Soup Base (onions, celery, carrots, maltodextrin, sugar, autolyzed yeast extract, onion powder, salt, water, corn oil, potassium chloride, carrot powder, modified tapioca starch, carrot juice concentrate, tomato paste, garlic powder, disodium guanylate, disodium inosinate, natural flavor, potassium sorbate, citric acid, extractives of paprika), Shredded Orange Carrots, Frozen Corn Kernels (sweet white corn), 1/2in Diced Green Bell Peppers, Achiote Paste (annatto seeds, vinegar, salt, water, granulated garlic, spices, sodium benzoate, corn meal, corn flour, FD&amp;C 40), Granulated Garlic, 1/2in Diced Celery, Coarse Flake Kosher Salt (salt, yellow prussiate of soda), Ground Cayenne Pepper, rice, vegetable/achiote broth), chipotle pinto beans (Canned pinto beans (pinto beans, water, salt, calcium chloride, calcium disodium edta), Tap Water, 1/2in Diced Green and Red Bell Peppers, 1/2in Diced Yellow Onions, Bottled Lemon Juice, Canola and Olive Oil Blend 90/10 (canola oil, extra virgin olive oil), Chipotle Peppers in Adobo Sauce (water, tomato paste, dried Chipotle peppers, distilled vinegar, corn oil. Contains 2% or less of iodized salt, potassium iodate, corn starch, onion powder, garlic powder, spices), Coarse Flake Kosher Salt (salt, yellow prussiate of soda)), southwest black beans (Canned black beans (prepared black beans, water, salt, calcium chloride, ferrous gluconate), 1/4in Diced Yellow Onions, 3/8in Diced Tomatoes, Whole Peeled Garlic Cloves, Canola Salad Oil, Fresh Cilantro Sprigs, Ground Cumin, Bottled Lime Juice, Coarse Flake Kosher Salt (salt, yellow prussiate of soda), Dried Dark Chili Powder (chili pepper, spices, salt, silicon dioxide, garlic), Tabasco Hot Sauce (distilled vinegar, red pepper, salt), Shaker Ground Black Pepper), sour cream (Sour cream (cultured cream. contains less than 2% of whey, modified corn starch, sodium tripolyphosphate, carrageenan, calcium sulfate, locust bean gum, guar gum, potassium sorbate)), salsa verde with red chile (Whole cleaned tomatillos, 1/4in Diced Yellow Onions, Bottled Lemon Juice, Iodized Granulated Salt (salt, sodium silicoaluminate, dextrose, potassium iodine, sodium bicarbonate), Whole Peeled Garlic Cloves, Fresh Cilantro Sprigs, Dried Whole Guajillo Chilis), red enchilada sauce (Russell ranch tomatoes (Whole roma tomatoes), Tap Water, 1/4in Diced Yellow Onions, Dried Ground Guajillo Pepper Powder (chili pepper, silicon dioxide [anti-caking agent], ethoxyquin [antioxidant agent]), Liquid Vegetable Soup Base (tomato juice from concentrate, salt, yeast extract, sugar, potato starch, contains 2% or less of carrot extract, natural flavors), Coarse Flake Kosher Salt (salt, yellow prussiate of soda), Whole Peeled Garlic Cloves, Canola and Olive Oil Blend 90/10 (canola oil, extra virgin olive oil), Chipotle Peppers in Adobo Sauce (water, tomato paste, dried Chipotle peppers, distilled vinegar, corn oil. Contains 2% or less of iodized salt, potassium iodate, corn starch, onion powder, garlic powder, spices), National Starch 465 (modified food starch), Ground Cumin, Dried Mexican Oregano Leaves, Dried Ground Cloves), traditional guacamole (Frozen avocado pulp, 1/4in Pico De Gallo (tomatoes, onion, fresh cilantro, Jalapeno pepper), Bottled Lime Juice, Iodized Granulated Salt (salt, sodium silicoaluminate, dextrose, potassium iodine, sodium bicarbonate), Ground Cumin), pico de gallo (1/4in pico de gallo (tomatoes, onion, fresh cilantro, jalapeno pepper)), shredded cheddar jack cheese (Shredded fancy cheddar jack cheese (cheddar cheese [pasteurized milk, cheese culture, salt, enzymes, annatto {vegetable color}], monterey jack cheese [pasteurized milk, cheese culture, salt, enzymes], anti-caking blend [potato starch, powdered cellulose])), queso fresco (Whole queso fresco cheese (pasteurized grade a milk, sea salt, enzymes)), soy chorizo crumbles (Soy chorizo sausage crumbles (water, organic textured soy protein [soy flour], organic soybean oil, organic distilled vinegar, organic seasoning [organic chile pepper, organic spices, salt, organic paprika, organic dextrose, organic ancho chile powder, organic onion powder, organic garlic powder, sea salt, natural extractives of paprika], salt, organic caramel color, natural extractives of paprika)), vegetable options:, bean options:, topping options:, rice options:"
Tercero Dining Commons,Tuesday,Lunch,Green,Salad Bar,"Sesame dressing (Toasted sesame dressing (water, inverted sugar, soybean oil and/or canola oil, rice vinegar, sesame oil, ginger, salt, contains less than 2% of citric acid, dehydrated lemon peel, dehydrated orange peel, hydrolyzed corn protein, lemon juice concentrate, modified corn starch, natural flavors, phosphoric acid, sesame seeds, soy sauce [water, wheat, soybeans, salt, alcohol], spices [contains mustard], xanthan gum)), ranch dressing (Ranch dressing (soybean oil, water, cultured low fat buttermilk, ranch seasoning and spices [salt, modified food starch, monosodium glutamate, sugar, dried garlic, dried onion, natural and artificial flavor {includes milk, soybean}, whey protein concentrate, corn syrup, spices, xanthan gum, sorbic acid and calcium disodium edta as preservatives, citric acid, calcium stearate], egg yolks, contains less than 2% of distilled vinegar, salt, xanthan gum, phosphoric acid, natural flavor [includes milk])), italian dressing (Fat free italian dressing (water, distilled vinegar, sugar, salt. contains less than 2% of modified food starch, garlic juice, dried garlic, dried onion, xanthan gum, sodium benzoate, potassium sorbate, dried red bell pepper, spices, phosphoric acid, soybean oil, extractive of carrot)), balsamic vinaigrette dressing (Balsamic vinaigrette dressing (water, high fructose corn syrup, balsamic vinegar, red wine vinegar, vegetable oil [soybean and canola], olive oil. contains less than 2% of salt, dried garlic, xanthan gum, spice, sodium alginate, propylene glycol alginate, calcium disodium edta)), caesar tuscan dressing (Caesar dressing (water, vegetable oil [soybean and/or canola oil], whole egg, parmesan cheese [pasteurized part skim milk, cheese culture, salt, enzymes], corn vinegar, salt, sugar, spices [mustard], anchovy paste [anchovies in salt, olive oil, acetic acid], egg yolks, distilled vinegar, dehydrated garlic, citric acid, natural flavors [from soy], lemon juice concentrate, extractive of rice, xanthan gum, dehydrated onion, sodium benzoate, sodium citrate, calcium disodium edta)), garbanzo beans (Canned garbanzo beans (prepared chickpeas, water, salt, calcium chloride, disodium edta)), kidney beans (Canned red kidney beans (dark red kidney beans, water, sugar, salt, calcium chloride, disodium edta)), tofu (Firm tofu), croutons (Seasoned homestyle crouton (enriched flour [wheat flour, malted barley flour, niacin, reduced iron, thiamin mononitrate, riboflavin, folic acid], canola and/or sunflower oil [with rosemary extract and ascorbic acid {to preserve freshness}], whey, salt, sugar, yeast, 2% or less of spices, dehydrated parsley, onion powder, paprika [color], turmeric [color], extractive of paprika [color], spice extractive, enzymes)), sliced cucumbers (1/4in sliced cucumbers), spring mix (Spring mix), baby spinach (Baby spinach leaves), julienned red onions (Julienned red onions), sliced cremini mushrooms (Sliced cremini mushrooms), corn kernels (Frozen corn kernels (sweet white corn)), julienned tri-colored peppers (Julienned tri-color bell peppers), shredded orange carrots (Shredded orange carrots), shredded cheddar cheese (Shredded feather yellow mild cheddar cheese (cultured milk, salt, enzymes, annatto, potato starch, natamycin)), diagonal cut celery (Diagonal cut celery), caesar salad (Creamy caesar dressing (water, vegetable oil [soybean and/or canola oil], whole egg, parmesan cheese [pasteurized part skim milk, cheese culture, salt, enzymes], corn vinegar, salt, sugar, spices [mustard], anchovy paste [anchovies in salt, olive oil, acetic acid], egg yolks, distilled vinegar, dehydrated garlic, citric acid, natural flavors [from soy], lemon juice concentrate, extractive of rice, xanthan gum, dehydrated onion, sodium benzoate, sodium citrate, calcium disodium edta), Chopped Romaine Lettuce, Shredded Parmesan Cheese (pasteurized part skim cow's milk, cheese cultures, salt, enzymes, potato starch, powdered cellulose, natamycin), Seasoned Homestyle Crouton (enriched flour [wheat flour, malted barley flour, niacin, reduced iron, thiamin mononitrate, riboflavin, folic acid], canola and/or sunflower oil [with rosemary extract and ascorbic acid {to preserve freshness}], whey, salt, sugar, yeast, 2% or less of spices, dehydrated parsley, onion powder, paprika [color], turmeric [color], extractive of paprika [color], spice extractive, enzymes)), roasted broccoli (Fresh broccoli florets, Canola and Olive Oil Blend 90/10 (canola oil, extra virgin olive oil), Coarse Flake Kosher Salt (salt, yellow prussiate of soda), Coarse Ground Black Pepper), boiled eggs (Whole large white eggs), diced tomatoes (3/8in diced tomatoes), sliced black olives (Canned sliced black olives (ripe olives, water, salt, ferrous gluconate))"
Tercero Dining Commons,Tuesday,Lunch,Green,Deli Bar,"Sliced white bread (Sliced white bread (enriched unbleached wheat flour [wheat flour, malted barley flour, niacin, reduced iron, thiamin mononitrate, riboflavin and folic acid], water, yeast, sugar, contains 2% or less of each of the following: salt, soybean oil, yeast nutrient [ammonium sulfate], dough conditioners [sodium stearoyl lactylate, ascorbic acid, monocalcium phosphate], extract of malted barley, dextrose, calcium propionate [mold inhibitor], enzymes)), wheat bread (Sliced wheat bread (enriched unbleached wheat flour [wheat flour, malted barley flour, niacin, reduced iron, thiamin mononitrate, riboflavin and folic acid], water, whole wheat flour, yeast, sugar. contains 2% or less of salt, vegetable oil [canola and/or soy], yeast nutrient [ammonium sulfate], dough conditioners [sodium stearoyl lactylate, ascorbic acid, monocalcium phosphate], caramel color, extract of malted barley, dextrose, calcium propionate, calcium sulfate, enzymes)), sourdough bread (Sliced sourdough bread (unbleached enriched flour [wheat flour, malted barley flour, niacin, iron, thiamin mononitrate, riboflavin, folic acid], water, yeast, wheat gluten. contains 2% or less of acetic acid, lactic acid, fumaric acid, soybean oil, high fructose corn syrup, sugar, salt, calcium propionate and potassium sorbate, datem, wheat flour, calcium sulfate, ascorbic acid, enzymes)), nine grain bread (Sliced nine grain bread (enriched unbleached wheat flour [wheat flour, malted barley flour, niacin, reduced iron, thiamin mononitrate, riboflavin and folic acid], water, granola mix [wheat, oats, triticale, barley, amaranth, rye, wheat germ, flax seeds, sunflower seeds, cornmeal], yeast, sugar, vital wheat gluten, brown sugar. contains 2% or less of vegetable oil [canola and/or soy], raisin paste, sunflower seeds, cultured wheat flour, distilled vinegar, xanthan gum, salt, ascorbic acid, calcium sulfate, enzymes, nonfat dry milk, soy flour)), sliced multigrain bread (Sliced multigrain bread (water, enriched unbleached flour [wheat flour, malted barley flour, niacin, reduced iron, thiamin mononitrate, riboflavin, folic acid], whole wheat flour, nine grain mix [blended wheat, barley, corn, millet, soybeans, rye, oats, rice, and flaxseed], sugar, flaxseed. contains 2% or less of oats, molasses, extra virgin olive oil, canola oil, sea salt, millet seeds, sunflower seeds, yeast, enzymes, ascorbic acid, caramel color)), sliced muenster cheese (Presliced muenster cheese (cultured pasteurized milk, salt, annatto, enzymes)), sliced monterey jack cheese (Presliced monterey jack cheese (pasteurized milk, cheese cultures, salt, enzymes)), swiss cheese (Presliced deli swiss cheese (pasteurized part-skim milk, cheese culture, salt, enzymes)), sliced pepper jack cheese (.5oz presliced pepper jack cheese (pasteurized milk, jalapeno peppers, cheese culture, salt, enzymes)), sliced cheddar cheese (3/4oz sliced cheddar cheese (pasteurized milk, cheese cultures, salt, enzymes)), sliced provolone cheese (3/4oz presliced provolone cheese (cultured pasteurized milk, salt, enzymes)), monterey pepper jack cheese (.75oz presliced monterey pepper jack cheese (pasteurized milk, red and green jalapeno peppers, cheese culture, salt, enzymes)), sliced smoked turkey (Presliced deli smoked turkey halal (turkey breast meat, water. contains 2% or less of salt, vinegar, sugar)), sliced smoked ham (Presliced deli smoked ham (ham. cured with water, salt, sugar, dextrose, sodium phosphates, sodium erythorbate, sodium nitrite)), sliced roast beef (Bottom round sliced roast beef (beef, water, vinegar, salt, natural flavorings, sodium phosphate. rubbed with salt, natural flavorings, caramel color)), sliced genoa salami (Sliced genoa salami (pork, beef, salt. contains 2% or less of dextrose, water, natural spices, sodium ascorbate, lactic acid starter culture, sodium nitrite, garlic powder, bha, bht, citric acid)), sliced salami (Sliced pastrami (beef, smoke flavoring, caramel color, spices, salt, sugar. cured with water, salt, sugar, sodium phosphates, sodium erythorbate, sodium nitrite, flavoring))"
Tercero Dining Commons,Tuesday,Lunch,Green,Cranberry Feta Pasta Salad,"Cranberry feta pasta salad (enriched pasta [wheat flour, niacin, ferrous sulfate {iron}, thiamin mononitrate, riboflavin, folic acid], bell peppers, feta cheese [pasteurized part-skim milk, salt, cheese cultures, enzymes], dried cranberries [sugar, sunflower oil], soybean oil, vinegar, dressing [sugar, salt, sodium citrate, dehydrated garlic, dehydrated onion, spice, carrot, xanthan gum, natural flavor, soy sauce {wheat, soybeans, salt}, citric acid], green onion)"
Tercero Dining Commons,Tuesday,Lunch,Green,Picnic Potato Salad,"Picnic potato salad (potatoes, mayonnaise [soybean oil, water, egg yolk, vinegar, contains less than 2% of corn syrup, salt, spice, lemon juice concentrate], green onions, garlic salt [salt, garlic, modified food starch, sugar, natural flavor, garlic oil], mustard [vinegar, water, mustard seed, salt, spice and coloring, natural flavor and garlic powder], natural flavor, sugar and spices)"
Tercero Dining Commons,Tuesday,Lunch,Green,Tuna Salad,"Precooked wild ahi yellowfin tuna (albacore tuna, water, salt), Heavy Duty Mayonnaise (soybean oil, water, corn syrup, egg yolks, distilled vinegar. Contains less than 2% of salt, mustard seed, calcium disodium EDTA), 1/4in Diced Celery, Sweet Green Pickle Relish (pickles, high fructose corn syrup, corn syrup, distilled vinegar, salt. Contains less than 2% of xanthan gum, spices, sodium benzoate, natural flavor, dehydrated red pepper, turmeric, polysorbate 80), 1/4in Diced Yellow Onions, Dijon Mustard (distilled white vinegar, mustard seed, water, salt, white wine, citric acid, tartaric acid, fruit pectin, sugar, spices), Bottled Lemon Juice, Ground White Pepper"
Tercero Dining Commons,Tuesday,Lunch,Green,Traditional Hummus,"Traditional hummus (cooked chickpeas, water, sesame tahini, olive oil. contains 2% or less of lemon juice, salt, garlic puree [garlic, citric acid, ascorbic acid], spices. per manufacturer, may contain soy)"
Tercero Dining Commons,Tuesday,Lunch,Green,Ham and White Bean Soup,"Canned small white beans (small white beans, water, salt, calcium chloride), Tap Water, Frozen Precooked Skin-on Diced Potatoes (potatoes, vegetable oil [soybean, canola, cottonseed, and/or sunflower]. Contains less than 2% of dextrose, maltodextrin, sea salt, tetrasodium pyrophosphate, disodium dihydrogen pyrophosphate), Endless Smoked Ham (pork cured with water, salt, dextrose, sodium phosphates, potassium lactate, potassium acetate, sodium diacetate, sodium erythorbate, sodium nitrite), 1/2in Diced Celery, 1/4in Diced Yellow Onions, Paste Ham Soup Base (salt, rendered pork fat [BHA, propyl gallate and citric acid to protect flavor], torula yeast, dextrose, palm and soybean oil, monosodium glutamate, hydrolyzed corn protein, natural smoke flavor, corn starch, onion powder, caramel color, natural flavorings), National Starch 465 (modified food starch), Whole Peeled Garlic Cloves, Canola Salad Oil, Iodized Granulated Salt (salt, sodium silicoaluminate, dextrose, potassium iodine, sodium bicarbonate), Dried Parsley Flakes, Shaker Ground Black Pepper"
Tercero Dining Commons,Tuesday,Lunch,Green,Carrot Spiced Soup,"Carrot spiced soup (vegetarian stock [water, natural vegetarian flavor {water, onion, carrot, celery, salt}], carrot puree, sweet potato, onion, expeller-pressed canola oil, orange juice concentrate, ginger puree, lemon juice, salt, basil, cornstarch, turmeric, cinnamon, cayenne pepper)"
