location,day,meal,zone,dish,ingredients
Tercero Dining Commons,Wednesday,Lunch,Green,Deli Bar,"Sliced white bread (Sliced white bread (enriched unbleached wheat flour [wheat flour, malted barley flour, niacin, reduced iron, thiamin mononitrate, riboflavin and folic acid], water, yeast, sugar, contains 2% or less of each of the following: salt, soybean oil, yeast nutrient [ammonium sulfate], dough conditioners [sodium stearoyl lactylate, ascorbic acid, monocalcium phosphate], extract of malted barley, dextrose, calcium propionate [mold inhibitor], enzymes)), wheat bread (Sliced wheat bread (enriched unbleached wheat flour [wheat flour, malted barley flour, niacin, reduced iron, thiamin mononitrate, riboflavin and folic acid], water, whole wheat flour, yeast, sugar. contains 2% or less of salt, vegetable oil [canola and/or soy], yeast nutrient [ammonium sulfate], dough conditioners [sodium stearoyl lactylate, ascorbic acid, monocalcium phosphate], caramel color, extract of malted barley, dextrose, calcium propionate, calcium sulfate, enzymes)), sourdough bread (Sliced sourdough bread (unbleached enriched flour [wheat flour, malted barley flour, niacin, iron, thiamin mononitrate, riboflavin, folic acid], water, yeast, wheat gluten. contains 2% or less of acetic acid, lactic acid, fumaric acid, soybean oil, high fructose corn syrup, sugar, salt, calcium propionate and potassium sorbate, datem, wheat flour, calcium sulfate, ascorbic acid, enzymes)), nine grain bread (Sliced nine grain bread (enriched unbleached wheat flour [wheat flour, malted barley flour, niacin, reduced iron, thiamin mononitrate, riboflavin and folic acid], water, granola mix [wheat, oats, triticale, barley, amaranth, rye, wheat germ, flax seeds, sunflower seeds, cornmeal], yeast, sugar, vital wheat gluten, brown sugar. contains 2% or less of vegetable oil [canola and/or soy], raisin paste, sunflower seeds, cultured wheat flour, distilled vinegar, xanthan gum, salt, ascorbic acid, calcium sulfate, enzymes, nonfat dry milk, soy flour)), sliced multigrain bread (Sliced multigrain bread (water, enriched unbleached flour [wheat flour, malted barley flour, niacin, reduced iron, thiamin mononitrate, riboflavin, folic acid], whole wheat flour, nine grain mix [blended wheat, barley, corn, millet, soybeans, rye, oats, rice, and flaxseed], sugar, flaxseed. contains 2% or less of oats, molasses, extra virgin olive oil, canola oil, sea salt, millet seeds, sunflower seeds, yeast, enzymes, ascorbic acid, caramel color)), sliced muenster cheese (Presliced muenster cheese (cultured pasteurized milk, salt, annatto, enzymes)), sliced monterey jack cheese (Presliced monterey jack cheese (pasteurized milk, cheese cultures, salt, enzymes)), swiss cheese (Presliced deli swiss cheese (pasteurized part-skim milk, cheese culture, salt, enzymes)), sliced pepper jack cheese (.5oz presliced pepper jack cheese (pasteurized milk, jalapeno peppers, cheese culture, salt, enzymes)), sliced cheddar cheese (3/4oz sliced cheddar cheese (pasteurized milk, cheese cultures, salt, enzymes)), sliced provolone cheese (3/4oz presliced provolone cheese (cultured pasteurized milk, salt, enzymes)), monterey pepper jack cheese (.75oz presliced monterey pepper jack cheese (pasteurized milk, red and green jalapeno peppers, cheese culture, salt, enzymes)), sliced smoked turkey (Presliced deli smoked turkey halal (turkey breast meat, water. contains 2% or less of salt, vinegar, sugar)), sliced smoked ham (Presliced deli smoked ham (ham. cured with water, salt, sugar, dextrose, sodium phosphates, sodium erythorbate, sodium nitrite)), sliced roast beef (Bottom round sliced roast beef (beef, water, vinegar, salt, natural flavorings, sodium phosphate. rubbed with salt, natural flavorings, caramel color)), sliced genoa salami (Sliced genoa salami (pork, beef, salt. contains 2% or less of dextrose, water, natural spices, sodium ascorbate, lactic acid starter culture, sodium nitrite, garlic powder, bha, bht, citric acid)), sliced salami (Sliced pastrami (beef, smoke flavoring, caramel color, spices, salt, sugar. cured with water, salt, sugar, sodium phosphates, sodium erythorbate, sodium nitrite, flavoring))"
Tercero Dining Commons,Wednesday,Lunch,Green,Chipotle Bacon Potato Salad,(inactive) chipotle bacon potato salad
Tercero Dining Commons,Wednesday,Lunch,Green,Sicilian Pasta Salad,"Sicilian pasta salad (enriched pasta [durum wheat semolina, tomato powder, spinach powder, niacin, ferrous lactate, thiamin mononitrate, riboflavin, folic acid], kidney beans, soybean oil, garbanzo beans, black olives, artichoke hearts, red bell pepper, yellow bell pepper, pepperoncini [italian hot peppers], vinegar, green olives stuffed with pimentos, sugar, sun dried tomatoes, red onion, balsamic vinegar, dressing [sugar, salt, sodium citrate, dehydrated garlic, dehydrated onion, spice, carrot, xanthan gum, natural flavor, soy sauce [wheat, soybeans, salt], garlic, salt, natural flavors)"
Tercero Dining Commons,Wednesday,Lunch,Green,Tuna Salad,"Precooked wild ahi yellowfin tuna (albacore tuna, water, salt), Heavy Duty Mayonnaise (soybean oil, water, corn syrup, egg yolks, distilled vinegar. Contains less than 2% of salt, mustard seed, calcium disodium EDTA), 1/4in Diced Celery, Sweet Green Pickle Relish (pickles, high fructose corn syrup, corn syrup, distilled vinegar, salt. Contains less than 2% of xanthan gum, spices, sodium benzoate, natural flavor, dehydrated red pepper, turmeric, polysorbate 80), 1/4in Diced Yellow Onions, Dijon Mustard (distilled white vinegar, mustard seed, water, salt, white wine, citric acid, tartaric acid, fruit pectin, sugar, spices), Bottled Lemon Juice, Ground White Pepper"
Tercero Dining Commons,Wednesday,Lunch,Green,Traditional Hummus,"Traditional hummus (cooked chickpeas, water, sesame tahini, olive oil. contains 2% or less of lemon juice, salt, garlic puree [garlic, citric acid, ascorbic acid], spices. per manufacturer, may contain soy)"
Tercero Dining Commons,Wednesday,Lunch,Green,Five Bean Chili,"Five bean vegan chili soup (daylight) (water, pinto beans, black beans, kidney beans, carrots, celery, corn, diced tomatoes [vine ripened fresh tomatoes, tomato juice, salt, calcium chloride, citric acid], tomato puree [fresh vine ripened california tomatoes, citric acid], white beans, tomato paste [vine ripened fresh tomatoes, citric acid], red bell pepper, garbanzo beans, onion, pasilla pepper, chipotle sauce [chili peppers, chipotle, natural flavor, salt, citric acid], brown sugar, lemon juice, sea salt, garlic, non-gmo canola oil, smoked paprika, cumin, hickory liquid smoke [water, natural hickory smoke flavor], cultured dextrose, oregano, chili powder, cinnamon)"
Tercero Dining Commons,Wednesday,Lunch,Green,Mexican Chicken Tortilla Soup,"Mexican chicken tortilla soup (daylight) (chicken broth, tomato puree [tomatoes, tomato puree, citric acid], chicken breast [chicken breast with rib meat, water, potato starch, salt, sugar, granulated garlic, black pepper], corn tortillas [water, stone ground corn masa flour, stone ground fresh corn. contains less than 2% of each of the following: cellulose gum, fumaric acid, potassium sorbate, calcium propionate, propionic acid, phosphoric acid, guar gum, sorbic acid, trace of lime], onion, red bell pepper, tomatoes, cilantro, tomato paste [vine-ripened fresh tomatoes, citric acid], sea salt, basil, jalapeno pepper, canola oil, cumin, hot sauce [aged cayenne red peppers, distilled vinegar, water, salt and garlic powder], cultured dextrose, chili powder, black pepper, oregano)"
Tercero Dining Commons,Wednesday,Lunch,Purple,Seasoned Pork Loin,"Pork loin rub (Fresh boneless c/c pork loin, Canola and Olive Oil Blend 90/10 (canola oil, extra virgin olive oil), Coarse Flake Kosher Salt (salt, yellow prussiate of soda), Granulated Garlic, Smoked Paprika (paprika, silicon dioxide), Coarse Ground Black Pepper, rub)"
Tercero Dining Commons,Wednesday,Lunch,Purple,Garlicky Kale,"Fresh shredded kale, Julienned Yellow Onions, Whole Peeled Garlic Cloves, Canola and Olive Oil Blend 90/10 (canola oil, extra virgin olive oil), Coarse Flake Kosher Salt (salt, yellow prussiate of soda), Shaker Ground Black Pepper"
Tercero Dining Commons,Wednesday,Lunch,Purple,White Beans with Kale,"Canned small white beans (small white beans, water, salt, calcium chloride), 1/2in Diced Celery, 1/4in Diced Red Onions, 3/8in Diced Tomatoes, Fresh Shredded Kale, Red Wine Vinegar (red wine vinegar, potassium metabisulfite, diluted with water to 5% acidity), Canola and Olive Oil Blend 90/10 (canola oil, extra virgin olive oil), Coarse Flake Kosher Salt (salt, yellow prussiate of soda), Fresh Italian Parsley Sprigs, Coarse Ground Black Pepper, Dried Whole Thyme Leaves, Rubbed Sage"
Tercero Dining Commons,Wednesday,Lunch,Purple,Lemon Roasted Carrots,"Carrot stick, Bottled Lemon Juice, Canola and Olive Oil Blend 90/10 (canola oil, extra virgin olive oil), Coarse Flake Kosher Salt (salt, yellow prussiate of soda), Shaker Ground Black Pepper"
Tercero Dining Commons,Wednesday,Lunch,Purple,Roasted Fingerling Potatoes,"Fresh whole fingerling potatoes, Canola and Olive Oil Blend 90/10 (canola oil, extra virgin olive oil), Coarse Flake Kosher Salt (salt, yellow prussiate of soda), Coarse Ground Black Pepper"
Tercero Dining Commons,Wednesday,Lunch,Pink,Raspberry Brownie Cheesecake Bar,"Raspberry brownie cheesecake bar (cream cheese [pasteurized cultured milk and cream, salt, xanthan and/or carob bean and/or guar gums], pure cane sugar, eggs, sour cream [cultured cream. contains 2% or less of whey, modified corn starch, sodium tripolyphosphate, guar gum, carrageenan, calcium sulfate, locust bean gum, potassium sorbate], vanilla extract, crumbs [graham flour, enriched wheat flour {wheat flour, enriched with niacin, reduced iron, thiamin mononitrate, riboflavin, folic acid}, sugar, corn flour, palm oil, corn syrup, molasses, whey, honey, sodium bicarbonate, sodium acid pyrophosphate, corn starch, salt, yellow 5, yellow 6, natural flavor, soy lecithin], butter [pasteurized cream, natural flavors], raspberry filling [water, high fructose corn syrup, red raspberries, sugar, modified corn starch. contains 2% or less of citric acid, natural flavor, lemon juice, potassium sorbate, salt, fd&amp;c red 40]. per manufacturer, produced in a facility that also uses dairy, eggs, fish, tree nuts, peanuts, wheat/gluten, soy, coconut, and sesame)"
Tercero Dining Commons,Wednesday,Lunch,Pink,Carmelita Bar,"Carmelita bar (butter [pasteurized cream {milk}, natural flavors], pecans, unbleached wheat flour [wheat flour, malted barley flour, niacin, reduced iron, thiamin mononitrate, riboflavin, folic acid], brown sugar, oats, honey, semisweet chocolate [{sugar, unsweetened chocolate, cocoa butter}, soy lecithin], corn syrup, vanilla extract [alcohol, bourbon vanilla beans, water], salt, baking soda, cinnamon. per manufacturer, produced in a facility that also uses dairy, eggs, fish, tree nuts, peanuts, wheat/gluten, soy, coconut, and sesame)"
Tercero Dining Commons,Wednesday,Lunch,Pink,Snickerdoodle Cookie,"2oz snickerdoodle cookie (unbleached wheat flour, pure cane sugars, butter [made from milk], pasteurized eggs, crème of tartar, sea salt, baking soda, pure vanilla, cinnamon. per manufacturer, this product is made in a facility that uses peanuts, tree nuts, milk, and soy)"
Tercero Dining Commons,Wednesday,Lunch,Pink,Dark Chocolate Cranberry Cookie,"Dark chocolate cranberry cookie (unbleached wheat flour, pure cane sugars, guittard bittersweet chocolate [fair trade cocoa beans, sugar, sunflower lecithin, pure vanilla], dried cranberries, butter [made from milk], eggs [pasteurized, may contain citric acid], grape juice, rice dextrins, pure vanilla, baking soda, sea salt. per manufacturer, this product is made in a facility that uses peanuts, tree nuts, milk, and soy)"
Tercero Dining Commons,Wednesday,Lunch,Pink,Oatmeal Raisin Cookie,"Vegan oatmeal raisin cookie (oatmeal, organic evaporated cane sugar, california raisins, unbleached wheat flour, non-hydrogenated palm oil shortening [rspo], grape juice, rice dextrins, pure vanilla, cinnamon, sea salt, baking soda. per manufacturer, this product is made in a facility that uses peanuts, tree nuts, milk, and soy)"
Tercero Dining Commons,Wednesday,Lunch,Pink,Chocolate Chip Cookie,"Vegan chocolate chip cookie (vegan chocolate chips [organic cane sugar, unsweetened chocolate, cocoa butter, soy lecithin, vanilla bean seeds], unbleached wheat flour, organic evaporated cane sugar, sustainable rspo palm oil shortening, vegan molasses, grape juice, rice dextrins, sea salt, pure vanilla, baking soda. per manufacturer, this product is made in a facility that uses peanuts, tree nuts, milk, and soy)"
Tercero Dining Commons,Wednesday,Dinner,Red,Grass-Fed Cheeseburger,"Cream co grass-fed beef patty, 4in Plain with Sesame Seeds Hamburger Bun (enriched unbleached wheat flour [wheat flour, malted barley flour, niacin, reduced iron, thiamin mononitrate, riboflavin, folic acid], water, sugar, yeast, soybean oil. Contains 2% or less of vital wheat gluten, salt, ammonium sulfate, sodium stearoyl lactylate, ascorbic acid, monocalcium phosphate, calcium sulfate, enzymes, calcium propionate, sesame seeds), American Cheese (milk, cream, water, sodium citrate, salt, cheese culture, sorbic acid, citric acid, enzymes, soy lecithin, apo carotenal, beta carotene)"
Tercero Dining Commons,Wednesday,Dinner,Red,Chipotle Black Bean Burger,"Chipotle black bean vegan patty (water, onions, cooked black beans [black beans, water], cooked brown rice [water, brown rice], corn, soy protein concentrate, tomatoes, wheat gluten, onion powder, vegetable oil [corn, canola and/or sunflower oil], green chiles, soy protein isolate, bulgur wheat, cornstarch. contains 2% or less of green peppers, red bell peppers, spices, tomato powder, cilantro, tomato juice, salt, chipotle pepper, methylcellulose, cooked onion and carrot juice concentrate, jalapeno pepper, carrageenan, garlic powder, natural flavor, paprika, soy sauce powder [soybeans, wheat, salt], gum arabic, vinegar, citric acid, red pepper, green pepper juice, turmeric, garlic juice, lime juice), 4in Plain with Sesame Seeds Hamburger Bun (enriched unbleached wheat flour [wheat flour, malted barley flour, niacin, reduced iron, thiamin mononitrate, riboflavin, folic acid], water, sugar, yeast, soybean oil. Contains 2% or less of vital wheat gluten, salt, ammonium sulfate, sodium stearoyl lactylate, ascorbic acid, monocalcium phosphate, calcium sulfate, enzymes, calcium propionate, sesame seeds), lemon garlic aioli (Vegan mayonnaise (soybean oil, water, organic distilled vinegar, contains less than 2% of salt, modified food starch, cane sugar, spice, natural flavor, lemon juice concentrate, calcium disodium edta, oleoresin paprika), Fresh Whole Lemons, Whole Peeled Garlic Cloves, Canola and Olive Oil Blend 90/10 (canola oil, extra virgin olive oil)), Canola and Olive Oil Blend 90/10 (canola oil, extra virgin olive oil)"
Tercero Dining Commons,Wednesday,Dinner,Red,Shoestring Potatoes,"1/4in frozen (shoestring) potatoes (potatoes, vegetable oil [soybean, canola, cottonseed, and/or sunflower], modified food starch. contains less than 2% of dextrose, sodium acid pyrophosphate, sodium bicarbonate, rice flour, salt, xanthan gum, disodium dihydrogen pyrophosphate), Rice Bran Fryer Oil (NGMO rice bran oil, RDW), seasoned salt (Iodized granulated salt (salt, sodium silicoaluminate, dextrose, potassium iodine, sodium bicarbonate), Onion Powder (onion powder), Granulated Garlic, Domestic Paprika (paprika, silicon dioxide), Vegan Fine Granulated White Sugar, Ground White Pepper)"
Tercero Dining Commons,Wednesday,Dinner,Yellow,Seared White Fish with Tomato Caper Sauce,"Seared white fish (White fish (atlantic cod, water, sodium tripolyphosphate), Canola and Olive Oil Blend 90/10 (canola oil, extra virgin olive oil), Coarse Flake Kosher Salt (salt, yellow prussiate of soda), Coarse Ground Black Pepper), fire roasted tomato with olives and caper sauce (Pouched diced fire roasted tomatoes (fire roasted tomatoes, tomato juice, sea salt, calcium chloride, naturally delivered citric acid), 1/2in Diced Yellow Onions, Sliced Green Manzanilla Olives (Manzanilla olives, water, salt, citric acid, sodium benzoate, potassium sorbate, ascorbic acid), White Cooking Wine (wine, water, neutral spirits, salt, tartaric acid, citric acid, potassium sorbate, potassium metabisulfite, caramel color), Non-Pareil Capers (capers, water, salt, vinegar), Whole Peeled Garlic Cloves, 1/4in Diced Jalapeno Peppers, Extra Virgin Olive Oil, Coarse Flake Kosher Salt (salt, yellow prussiate of soda), Fresh Italian Parsley Sprigs, Dried Mexican Oregano Leaves, Coarse Ground Black Pepper), Extra Virgin Olive Oil, Fresh Italian Parsley Sprigs"
Tercero Dining Commons,Wednesday,Dinner,Yellow,Combo Pizza,"12 in round fellas flatbread (soft wheat flour, water, sourdough [water, soft wheat flour], microfiltered sea water, iodized sea salt, extra-virgin olive oil. per manufacturer, may contain traces of milk, soy, sesame seeds, mustard, almonds, nuts, and pine nuts), pizza sauce (Canned coarse ground peeled pear tomatoes (tomatoes, tomato puree, salt, citric acid), Whole Peeled Garlic Cloves, Iodized Granulated Salt (salt, sodium silicoaluminate, dextrose, potassium iodine, sodium bicarbonate), Ground Cayenne Pepper, Italian Seasoning (marjoram, thyme, rosemary, savory, sage, oregano, basil), Coarse Ground Black Pepper, Dried Whole Thyme Leaves, Dried Whole Marjoram Leaves, Dried Mediterranean Oregano Leaves, Dried Basil Leaves (dried basil)), Shredded Whole Milk Mozzarella Cheese (pasteurized milk, cheese cultures, salt, enzymes), Sliced Genoa Salami (pork, beef, salt. Contains 2% or less of dextrose, water, natural spices, sodium ascorbate, lactic acid starter culture, sodium nitrite, garlic powder, BHA, BHT, citric acid), Italian Cooked Sausage Topping (pork, water, spices, salt, sugar, flavorings), Pepperoni Halal Sliced (chicken, beef, turkey, salt. Contains 2% or less of water, dextrose, spices, smoke flavoring, flavoring, garlic powder, oleoresin of paprika, rosemary extract, sodium ascorbate, spice extractive, citric acid, lactic acid starter culture, BHA, BHT, sodium nitrite), Shredded Parmesan Cheese (pasteurized part skim cow's milk, cheese cultures, salt, enzymes, potato starch, powdered cellulose, natamycin), 1/2in Diced Green Bell Peppers, 1/4in Diced Red Onions, sautéed cremini mushrooms (Sliced cremini mushrooms, White Cooking Wine (wine, water, neutral spirits, salt, tartaric acid, citric acid, potassium sorbate, potassium metabisulfite, caramel color), Canola Salad Oil, Coarse Flake Kosher Salt (salt, yellow prussiate of soda), Fresh Sage Leaves), Semolina (semolina, niacin, ferrous sulfate, thiamin mononitrate, riboflavin, folic acid), garlic infused oil (Canola salad oil, Granulated Garlic, Italian Seasoning (marjoram, thyme, rosemary, savory, sage, oregano, basil))"
Tercero Dining Commons,Wednesday,Dinner,Yellow,Herbed Mozzarella Pizza,"12 in round fellas flatbread (soft wheat flour, water, sourdough [water, soft wheat flour], microfiltered sea water, iodized sea salt, extra-virgin olive oil. per manufacturer, may contain traces of milk, soy, sesame seeds, mustard, almonds, nuts, and pine nuts), Fresh Sliced Mozzarella Cheese (pasteurized milk, vinegar, enzymes, salt), Whole Oyster Mushroom, Basil Pesto Sauce without Nuts (basil, canola oil, water, Parmesan cheese [pasteurized part-skim cows’ milk, cheese culture, salt, enzymes], granulated garlic, salt), Whole Peeled Shallots, roasted garlic oil (Whole peeled garlic cloves, Canola and Olive Oil Blend 90/10 (canola oil, extra virgin olive oil), Fresh Thyme Sprigs, Fresh Oregano Sprigs), Canola and Olive Oil Blend 90/10 (canola oil, extra virgin olive oil), Semolina (semolina, niacin, ferrous sulfate, thiamin mononitrate, riboflavin, folic acid), Fresh Italian Parsley Sprigs, Fresh Thyme Sprigs, Fresh Whole Rosemary Sprigs, Coarse Flake Kosher Salt (salt, yellow prussiate of soda), Coarse Ground Black Pepper"
Tercero Dining Commons,Wednesday,Dinner,Blue,Pork Tamale,"Pork tamale (masa ingredients: whole cooked corn [corn treated with lime water], lard, rice flour, salt. filling ingredients: pork, chile sauce [water, red chili peppers], water. contains 2% or less of jalapeno peppers [jalapeno peppers, water, vinegar, salt], corn [corn treated with lime water], salt, seasoning [chili pepper, red pepper, garlic powder, salt, spices]), red enchilada sauce (Russell ranch tomatoes (Whole roma tomatoes), Tap Water, 1/4in Diced Yellow Onions, Dried Ground Guajillo Pepper Powder (chili pepper, silicon dioxide [anti-caking agent], ethoxyquin [antioxidant agent]), Liquid Vegetable Soup Base (tomato juice from concentrate, salt, yeast extract, sugar, potato starch, contains 2% or less of carrot extract, natural flavors), Coarse Flake Kosher Salt (salt, yellow prussiate of soda), Whole Peeled Garlic Cloves, Canola and Olive Oil Blend 90/10 (canola oil, extra virgin olive oil), Chipotle Peppers in Adobo Sauce (water, tomato paste, dried Chipotle peppers, distilled vinegar, corn oil. Contains 2% or less of iodized salt, potassium iodate, corn starch, onion powder, garlic powder, spices), National Starch 465 (modified food starch), Ground Cumin, Dried Mexican Oregano Leaves, Dried Ground Cloves), Whole Queso Fresco Cheese (pasteurized grade A milk, sea salt, enzymes), Fresh Cilantro Sprigs"
Tercero Dining Commons,Wednesday,Dinner,Blue,Mexican Rice,"Tap water, Dried White Long Grain Rice, Canned Crushed Tomatoes (tomatoes, tomato puree, sea salt, citric acid), Canola Salad Oil, 1/4in Diced Yellow Onions, Paste Vegetable Soup Base (onions, celery, carrots, maltodextrin, sugar, autolyzed yeast extract, onion powder, salt, water, corn oil, potassium chloride, carrot powder, modified tapioca starch, carrot juice concentrate, tomato paste, garlic powder, disodium guanylate, disodium inosinate, natural flavor, potassium sorbate, citric acid, extractives of paprika), Shredded Orange Carrots, Frozen Corn Kernels (sweet white corn), 1/2in Diced Green Bell Peppers, Achiote Paste (annatto seeds, vinegar, salt, water, granulated garlic, spices, sodium benzoate, corn meal, corn flour, FD&amp;C 40), Granulated Garlic, 1/2in Diced Celery, Coarse Flake Kosher Salt (salt, yellow prussiate of soda), Ground Cayenne Pepper, rice, vegetable/achiote broth"
Tercero Dining Commons,Wednesday,Dinner,Blue,Plant Forward Tostada,"Refried pinto beans (Canned pinto beans (pinto beans, water, salt, calcium chloride, calcium disodium edta), Canola Salad Oil, Ground Cumin, Whole Peeled Garlic Cloves, Coarse Flake Kosher Salt (salt, yellow prussiate of soda)), Fresh Shredded Green Cabbage, 6in White Corn Tortillas (water, stone ground corn masa flour, stone ground fresh corn. Contains less than 2% of cellulose gum, fumaric acid, potassium sorbate, calcium propionate, propionic acid, phosphoric acid, guar gum, sorbic acid, trace of lime), 3/8in Diced Tomatoes, fiesta dressing (Canola salad oil, Fresh Cilantro Sprigs, Red Wine Vinegar (red wine vinegar, potassium metabisulfite, diluted with water to 5% acidity), fajita seasoning (Iodized granulated salt (salt, sodium silicoaluminate, dextrose, potassium iodine, sodium bicarbonate), Onion Powder (onion powder), Vegan Fine Granulated White Sugar, Lemon Pepper Spice Mix (salt, spices, citric acid, onion, monosodium glutamate, sugar, corn starch, garlic, silicon dioxide, natural flavor, FD&amp;C yellow 5), Granulated Garlic, Domestic Paprika (paprika, silicon dioxide), Ground Cumin, Vegan Fine Granulated White Sugar, Ground White Pepper, season salt, production), Iodized Granulated Salt (salt, sodium silicoaluminate, dextrose, potassium iodine, sodium bicarbonate), Tabasco Hot Sauce (distilled vinegar, red pepper, salt)), Fresh Sliced Radishes, Fresh Shredded Red Cabbage, 1/2in Diced Yellow Bell Peppers, Matchstick Daikon Radishes, Whole Green Onions, Canned Sliced Black Olives (ripe olives, water, salt, ferrous gluconate), fiesta slaw"
